{"$id":"https://contextualwisdomlab.github.io/naruon/schemas/email_writing_judge_policy.schema.json","$schema":"https://json-schema.org/draft/2020-12/schema","additionalProperties":false,"allOf":[{"if":{"properties":{"status":{"const":"published"}},"required":["status"]},"then":{"properties":{"calibration_summary":{"properties":{"status":{"const":"validated"}},"required":["status"]},"evidence":{"properties":{"calibration_dataset_hash":{"type":"string"},"holdout_labels_accessed_after_preregistration":{"const":true},"locked_holdout_hash":{"type":"string"},"protocol_hash":{"type":"string"},"reference_adjudication_hash":{"type":"string"}},"required":["protocol_hash","calibration_dataset_hash","locked_holdout_hash","reference_adjudication_hash","holdout_labels_accessed_after_preregistration"]},"publish_decision":{"const":"publish"}}}},{"if":{"properties":{"status":{"enum":["evaluation_only","superseded","revoked"]}},"required":["status"]},"then":{"properties":{"publish_decision":{"const":"withhold"}}}}],"properties":{"adjudication_conditions":{"items":{"enum":["same_model_without_compatible_calibration","criterion_disagreement","insufficient_evidence"]},"type":"array","uniqueItems":true},"approved_profiles":{"items":{"additionalProperties":false,"properties":{"candidate_model_profile_id":{"type":"string"},"candidate_provider_id":{"type":"string"},"judge_model_profile_id":{"type":"string"},"judge_provider_id":{"type":"string"},"language_tags":{"items":{"maxLength":63,"minLength":1,"type":"string"},"maxItems":32,"minItems":1,"type":"array","uniqueItems":true},"profile_id":{"type":"string"},"review_modes":{"items":{"enum":["incremental","deep"]},"maxItems":2,"minItems":1,"type":"array","uniqueItems":true},"rubric_version":{"type":"string"},"same_model_allowed":{"type":"boolean"}},"required":["profile_id","language_tags","review_modes","candidate_model_profile_id","candidate_provider_id","judge_model_profile_id","judge_provider_id","rubric_version","same_model_allowed"],"type":"object"},"maxItems":64,"minItems":1,"type":"array"},"calibration_summary":{"additionalProperties":false,"properties":{"brier_score":{"maximum":1.0,"minimum":0.0,"type":["number","null"]},"dif_profiles_evaluated":{"minimum":0,"type":"integer"},"status":{"enum":["not_evaluated","validated"]},"temporal_drift_evaluated":{"type":"boolean"},"test_retest_reliability":{"maximum":1.0,"minimum":0.0,"type":["number","null"]}},"required":["status","brier_score","test_retest_reliability","dif_profiles_evaluated","temporal_drift_evaluated"],"type":"object"},"category_anchors":{"items":{"type":"string"},"maxItems":9,"minItems":2,"type":"array","uniqueItems":true},"category_count":{"maximum":9,"minimum":2,"type":"integer"},"compatible_contracts":{"additionalProperties":false,"properties":{"contextual_orchestrator":{"type":"string"},"fast_mlsirm":{"type":["string","null"]},"inkspan":{"type":["string","null"]},"naruon":{"type":"string"}},"required":["naruon","inkspan","fast_mlsirm","contextual_orchestrator"],"type":"object"},"created_at":{"format":"date-time","type":"string"},"evidence":{"additionalProperties":false,"properties":{"calibration_dataset_hash":{"pattern":"^sha256:[0-9a-f]{64}$","type":["string","null"]},"holdout_labels_accessed_after_preregistration":{"type":"boolean"},"locked_holdout_hash":{"pattern":"^sha256:[0-9a-f]{64}$","type":["string","null"]},"protocol_hash":{"pattern":"^sha256:[0-9a-f]{64}$","type":["string","null"]},"reference_adjudication_hash":{"pattern":"^sha256:[0-9a-f]{64}$","type":["string","null"]}},"required":["protocol_hash","calibration_dataset_hash","locked_holdout_hash","reference_adjudication_hash","holdout_labels_accessed_after_preregistration"],"type":"object"},"expires_at":{"format":"date-time","type":"string"},"limitations":{"items":{"maxLength":1000,"minLength":1,"type":"string"},"maxItems":64,"minItems":1,"type":"array"},"mandatory_criterion_floors":{"additionalProperties":false,"properties":{"actionability":{"maximum":8,"minimum":0,"type":"integer"},"audience_pragmatics":{"maximum":8,"minimum":0,"type":"integer"},"explanation_quality":{"maximum":8,"minimum":0,"type":"integer"},"fact_preservation":{"maximum":8,"minimum":0,"type":"integer"},"intent_preservation":{"maximum":8,"minimum":0,"type":"integer"},"issue_support":{"maximum":8,"minimum":0,"type":"integer"},"replacement_correctness":{"maximum":8,"minimum":0,"type":"integer"},"request_strength_preservation":{"maximum":8,"minimum":0,"type":"integer"},"span_fidelity":{"maximum":8,"minimum":0,"type":"integer"},"technical_precision":{"maximum":8,"minimum":0,"type":"integer"}},"required":["issue_support","span_fidelity","replacement_correctness","intent_preservation","fact_preservation","request_strength_preservation","audience_pragmatics","technical_precision","actionability","explanation_quality"],"type":"object"},"minimum_criterion_scores":{"additionalProperties":false,"properties":{"actionability":{"maximum":1.0,"minimum":0.0,"type":"number"},"audience_pragmatics":{"maximum":1.0,"minimum":0.0,"type":"number"},"explanation_quality":{"maximum":1.0,"minimum":0.0,"type":"number"},"fact_preservation":{"maximum":1.0,"minimum":0.0,"type":"number"},"intent_preservation":{"maximum":1.0,"minimum":0.0,"type":"number"},"issue_support":{"maximum":1.0,"minimum":0.0,"type":"number"},"replacement_correctness":{"maximum":1.0,"minimum":0.0,"type":"number"},"request_strength_preservation":{"maximum":1.0,"minimum":0.0,"type":"number"},"span_fidelity":{"maximum":1.0,"minimum":0.0,"type":"number"},"technical_precision":{"maximum":1.0,"minimum":0.0,"type":"number"}},"required":["issue_support","span_fidelity","replacement_correctness","intent_preservation","fact_preservation","request_strength_preservation","audience_pragmatics","technical_precision","actionability","explanation_quality"],"type":"object"},"policy_id":{"pattern":"^[A-Za-z0-9][A-Za-z0-9._:-]{0,127}$","type":"string"},"policy_version":{"pattern":"^[A-Za-z0-9][A-Za-z0-9._:-]{0,127}$","type":"string"},"publish_decision":{"enum":["publish","withhold"]},"required_criteria_by_candidate_kind":{"additionalProperties":false,"properties":{"no_replacement_diagnostic":{"items":{"enum":["issue_support","span_fidelity","replacement_correctness","intent_preservation","fact_preservation","request_strength_preservation","audience_pragmatics","technical_precision","actionability","explanation_quality"]},"minItems":1,"type":"array","uniqueItems":true},"replacement_diagnostic":{"items":{"enum":["issue_support","span_fidelity","replacement_correctness","intent_preservation","fact_preservation","request_strength_preservation","audience_pragmatics","technical_precision","actionability","explanation_quality"]},"minItems":1,"type":"array","uniqueItems":true}},"required":["replacement_diagnostic","no_replacement_diagnostic"],"type":"object"},"rollback_version":{"type":["string","null"]},"status":{"enum":["evaluation_only","published","superseded","revoked"]}},"required":["policy_id","policy_version","status","publish_decision","created_at","expires_at","compatible_contracts","approved_profiles","category_count","category_anchors","required_criteria_by_candidate_kind","mandatory_criterion_floors","minimum_criterion_scores","adjudication_conditions","calibration_summary","evidence","limitations","rollback_version"],"title":"Naruon Email Writing Judge Policy","type":"object"}
