{"adjudication_conditions":["same_model_without_compatible_calibration","criterion_disagreement","insufficient_evidence"],"approved_profiles":[{"candidate_model_profile_id":"candidate-reviewer-v1","candidate_provider_id":"contextual-orchestrator","judge_model_profile_id":"independent-judge-v1","judge_provider_id":"contextual-orchestrator","language_tags":["en","ko"],"profile_id":"email-writing-evaluation-en-ko-v1","review_modes":["incremental","deep"],"rubric_version":"email_writing_judge_rubric_v1","same_model_allowed":false}],"calibration_summary":{"brier_score":null,"dif_profiles_evaluated":0,"status":"not_evaluated","temporal_drift_evaluated":false,"test_retest_reliability":null},"category_anchors":["no_credible_evidence","partial_or_weak_support","mostly_supported_with_gaps","fully_supported_with_accurate_evidence"],"category_count":4,"compatible_contracts":{"contextual_orchestrator":"v1","fast_mlsirm":null,"inkspan":null,"naruon":"0.14.4"},"created_at":"2026-09-01T00:00:00Z","evidence":{"calibration_dataset_hash":null,"holdout_labels_accessed_after_preregistration":false,"locked_holdout_hash":null,"protocol_hash":null,"reference_adjudication_hash":null},"expires_at":"2027-01-01T00:00:00Z","limitations":["Evaluation-only artifact. It cannot admit user-facing writing diagnostics.","No language, model, provider, calibration, DIF, reliability, or drift validity claim is published by this artifact.","Threshold values are placeholders for pipeline exercise only and are not production admission thresholds."],"mandatory_criterion_floors":{"actionability":0,"audience_pragmatics":0,"explanation_quality":0,"fact_preservation":0,"intent_preservation":0,"issue_support":0,"replacement_correctness":0,"request_strength_preservation":0,"span_fidelity":0,"technical_precision":0},"minimum_criterion_scores":{"actionability":0.0,"audience_pragmatics":0.0,"explanation_quality":0.0,"fact_preservation":0.0,"intent_preservation":0.0,"issue_support":0.0,"replacement_correctness":0.0,"request_strength_preservation":0.0,"span_fidelity":0.0,"technical_precision":0.0},"policy_id":"email_writing_judge_policy","policy_version":"email-writing-evaluation-only-v1","publish_decision":"withhold","required_criteria_by_candidate_kind":{"no_replacement_diagnostic":["issue_support","span_fidelity","intent_preservation","fact_preservation","request_strength_preservation","audience_pragmatics","technical_precision","actionability","explanation_quality"],"replacement_diagnostic":["issue_support","span_fidelity","replacement_correctness","intent_preservation","fact_preservation","request_strength_preservation","audience_pragmatics","technical_precision","actionability","explanation_quality"]},"rollback_version":null,"status":"evaluation_only"}
